{
  "capability": {
    "name": "ui.__KIND__.__DOMAIN__.__WIDGET__",
    "version": "1.0.0",
    "category": "ui",
    "summary": "UI contract for __WIDGET__ (__KIND__).",
    "lifecycle": "draft"
  },
  "type": "ui",
  "signature": {
    "model": "ui-interaction",
    "requestSchema": "schemas/request.json",
    "responseSchema": "schemas/response.json",
    "errorSchema": "schemas/error.json",
    "uiSchema": "schemas/ui.json"
  },
  "semantics": {
    "idempotent": true,
    "sideEffect": false,
    "transactional": false
  },
  "examples": ["examples/success.json", "examples/failure.json"],
  "tests": { "contractTests": "tests/contract-tests.yaml" }
}
