{
  "capability": {
    "name": "integration.webhook.receive",
    "version": "1.0.0",
    "category": "integration",
    "summary": "Accept an inbound webhook: verify provider signature, normalize payload, dedupe by event id.",
    "lifecycle": "draft"
  },
  "type": "integration",
  "signature": {
    "model": "request-response",
    "requestSchema": "schemas/request.json",
    "responseSchema": "schemas/response.json",
    "errorSchema": "schemas/error.json"
  },
  "semantics": {
    "idempotent": true,
    "sideEffect": true,
    "transactional": true
  },
  "examples": [
    "examples/success.json",
    "examples/failure.json"
  ],
  "tests": {
    "contractTests": "tests/contract-tests.yaml"
  }
}
