{
  "capability": {
    "name": "integration.__SYSTEM__.__ACTION__",
    "version": "1.0.0",
    "category": "integration",
    "summary": "__ONE_LINE_SUMMARY__",
    "lifecycle": "draft"
  },
  "type": "integration",
  "signature": {
    "model": "request-response",
    "requestSchema": "schemas/request.json",
    "responseSchema": "schemas/response.json",
    "errorSchema": "schemas/error.json"
  },
  "semantics": {
    "idempotent": false,
    "sideEffect": true,
    "transactional": true
  },
  "examples": ["examples/success.json", "examples/failure.json"],
  "tests": { "contractTests": "tests/contract-tests.yaml" }
}
