{
  "capability": {
    "name": "customer.search",
    "version": "1.0.0",
    "category": "customer",
    "summary": "Search customer records with optional text query and paging. Items may include primaryContactId (contact.*).",
    "lifecycle": "draft"
  },
  "type": "service",
  "signature": {
    "model": "request-response",
    "requestSchema": "schemas/request.json",
    "responseSchema": "schemas/response.json",
    "errorSchema": "schemas/error.json"
  },
  "semantics": {
    "idempotent": true,
    "sideEffect": false,
    "transactional": false
  },
  "examples": [
    "examples/success.json",
    "examples/failure.json"
  ],
  "tests": {
    "contractTests": "tests/contract-tests.yaml"
  }
}
