{
  "capability": {
    "name": "invoice.create",
    "version": "1.0.0",
    "category": "invoice",
    "summary": "Create an AR invoice from billing lines and customer reference.",
    "lifecycle": "draft"
  },
  "type": "service",
  "signature": {
    "model": "request-response",
    "requestSchema": "schemas/request.json",
    "responseSchema": "schemas/response.json",
    "errorSchema": "schemas/error.json"
  },
  "semantics": {
    "idempotent": false,
    "sideEffect": true,
    "transactional": true
  },
  "examples": [
    "examples/success.json",
    "examples/failure.json"
  ],
  "tests": {
    "contractTests": "tests/contract-tests.yaml"
  }
}
