{
  "capability": {
    "name": "object.put",
    "version": "1.0.0",
    "category": "object",
    "summary": "Register or complete put of an object into a bucket/key namespace.",
    "lifecycle": "draft"
  },
  "type": "resource",
  "signature": {
    "model": "request-response",
    "requestSchema": "schemas/request.json",
    "responseSchema": "schemas/response.json",
    "errorSchema": "schemas/error.json"
  },
  "semantics": {
    "idempotent": false,
    "sideEffect": true,
    "transactional": false
  },
  "examples": [
    "examples/success.json",
    "examples/failure.json"
  ],
  "tests": {
    "contractTests": "tests/contract-tests.yaml"
  }
}
